{
  "schema_version": "1.0",
  "kind": "refuse",
  "call_id": "c-7f3a93",
  "ts_ms": 1790000001000,
  "consumer": "awork",
  "agent": "research",
  "session": "build-2026-10-01-a",
  "role": "extractor",
  "purpose": "extract_claims",
  "model": "gpt-5-mini",
  "provider": "openrouter",
  "alias": "cheap",
  "scope": {"kind": "kernel", "key": null, "value": null},
  "cap_usd": 5.0,
  "cap_tokens": null,
  "spent_usd": 4.99,
  "spent_tokens": 1800000,
  "reserved_usd": 0.0,
  "reserved_tokens": 0,
  "remaining_usd": 0.01,
  "remaining_tokens": null,
  "worst_case_usd": 0.02,
  "worst_case_tokens": 9000,
  "refusal": {"code": "cap_usd", "message": "worst case $0.020000 on top of $4.990000 exceeds limit_usd=$5.000000"},
  "producer": {"name": "moeka", "version": "0.1"}
}
